{
  "schema": "flossware.tui/1.0",
  "id": "example-menu",
  "title": "Example Menu",
  "menus": [
    {
      "id": "config",
      "label": "Config",
      "items": [
        {
          "id": "profiles",
          "label": "Profiles",
          "accelerator": "p",
          "action": "profiles"
        },
        {
          "id": "quit",
          "label": "Quit",
          "accelerator": "q",
          "action": "quit"
        }
      ]
    }
  ],
  "windows": [
    {
      "id": "main",
      "kind": "window",
      "title": "Example",
      "movable": true,
      "resizable": true,
      "content": [
        {
          "id": "status",
          "type": "label",
          "label": "Ready",
          "focusable": false
        }
      ]
    }
  ]
}
